{
  "contracts": {
    "recipes": [
      "inflammation_score_v1",
      "metabolic_score_v1",
      "circadian_score_v1"
    ],
    "suite": "biomed_v1"
  },
  "manifest": {
    "baseline_label": "t0",
    "hash": "3c77fa8a58e43923224a9fc7e9d86dd678d380a0e1cc1311f1be27d782bf0d07",
    "post_labels": [
      "t24",
      "t72",
      "t168"
    ],
    "ref": "fixtures/biomed_io_v1/levelc/intervention_manifest.json",
    "subject_id": "fixture_subject_01"
  },
  "provenance": {
    "created_utc": "1970-01-01T00:00:00+00:00",
    "evidence_hash": "28d80229846c5529b131811e5b187d3d9fae285fdb880d05a4edbcfcb0f1c4ea",
    "tool_version": "1.3.3"
  },
  "recipes": [
    {
      "kind": "labs",
      "plasticity2": {
        "candidate": {
          "evidence_hash": "72fe6166958513afabffc293d293c17e162dd507abdd41314ff49e8703135739",
          "metrics": {
            "D_peak": 0.67,
            "auc_D": 39.879999999984,
            "mean_C": 0.842324239897,
            "mean_R": 0.551133222775,
            "t_peak_hours": 24.0,
            "t_recover_80_hours": 168.0
          },
          "schema": "semiocore.biomed.plasticity2_report.v1"
        },
        "metric_diffs": {
          "auc_D_abs": 1.6e-11,
          "mean_C_abs": 0.0,
          "mean_R_abs": 0.0
        },
        "oracle": {
          "evidence_hash": "72fe6166958513afabffc293d293c17e162dd507abdd41314ff49e8703135739",
          "metrics": {
            "D_peak": 0.67,
            "auc_D": 39.88,
            "mean_C": 0.842324239897,
            "mean_R": 0.551133222775,
            "t_peak_hours": 24.0,
            "t_recover_80_hours": 168.0
          },
          "schema": "semiocore.biomed.plasticity2_report.v1"
        },
        "within_tolerance": false
      },
      "recipe": "inflammation_score_v1",
      "recovery": {
        "candidate": {
          "evidence_hash": "72fe6166958513afabffc293d293c17e162dd507abdd41314ff49e8703135739",
          "metrics": {
            "D_peak": 0.67,
            "t_peak_hours": 24.0,
            "t_recover_80_hours": 168.0
          },
          "schema": "semiocore.biomed.recovery_report.v1"
        },
        "metric_diffs": {
          "D_peak_abs": 0.0,
          "t_peak_hours_abs": 0.0,
          "t_recover_80_hours_abs": 0.0
        },
        "oracle": {
          "evidence_hash": "72fe6166958513afabffc293d293c17e162dd507abdd41314ff49e8703135739",
          "metrics": {
            "D_peak": 0.67,
            "t_peak_hours": 24.0,
            "t_recover_80_hours": 168.0
          },
          "schema": "semiocore.biomed.recovery_report.v1"
        },
        "within_tolerance": true
      },
      "timepoints": [
        {
          "candidate_ref": "expected/biomed_levelc_v1/score/inflammation_score_v1/t0.score.json",
          "label": "t0",
          "raw_ref": "fixtures/biomed_io_v1/levelc/labs_t0.json",
          "score_compare": {
            "baseline": {
              "score": 0.11,
              "score_hash": "cb9418e87a4c71bd4af8db0c4b25a67f334d66daaabc5e17a9ebe93b23638060"
            },
            "candidate": {
              "score": 0.11,
              "score_hash": "cb9418e87a4c71bd4af8db0c4b25a67f334d66daaabc5e17a9ebe93b23638060"
            },
            "diff": {
              "features_max_abs": 0.0,
              "score_abs": 0.0
            },
            "feature_diffs": [
              {
                "abs": 0.0,
                "baseline": 1.0,
                "candidate": 1.0,
                "feature": "crp_mg_L"
              },
              {
                "abs": 0.0,
                "baseline": 0.1,
                "candidate": 0.1,
                "feature": "crp_risk"
              },
              {
                "abs": 0.0,
                "baseline": 1.5,
                "candidate": 1.5,
                "feature": "nlr"
              },
              {
                "abs": 0.0,
                "baseline": 0.125,
                "candidate": 0.125,
                "feature": "nlr_risk"
              }
            ],
            "provenance": {
              "created_utc": "1970-01-01T00:00:00+00:00",
              "evidence_hash": "442195cca2ac80aa9c2fb7de57ff292a50c0971a166c874f400002ede2128964",
              "tool_version": "1.3.3"
            },
            "recipe": "inflammation_score_v1",
            "schema": "semiocore.audit.score_compare_report.v1",
            "tolerance_abs": 0.0,
            "within_tolerance": true
          }
        },
        {
          "candidate_ref": "expected/biomed_levelc_v1/score/inflammation_score_v1/t24.score.json",
          "label": "t24",
          "raw_ref": "fixtures/biomed_io_v1/levelc/labs_t24.json",
          "score_compare": {
            "baseline": {
              "score": 0.78,
              "score_hash": "a364d35e93e9b775fdd1feb09755af58db6d5fe0770b83d1b0cc8bf612119fc8"
            },
            "candidate": {
              "score": 0.78,
              "score_hash": "a364d35e93e9b775fdd1feb09755af58db6d5fe0770b83d1b0cc8bf612119fc8"
            },
            "diff": {
              "features_max_abs": 0.0,
              "score_abs": 0.0
            },
            "feature_diffs": [
              {
                "abs": 0.0,
                "baseline": 8.0,
                "candidate": 8.0,
                "feature": "crp_mg_L"
              },
              {
                "abs": 0.0,
                "baseline": 0.8,
                "candidate": 0.8,
                "feature": "crp_risk"
              },
              {
                "abs": 0.0,
                "baseline": 4.0,
                "candidate": 4.0,
                "feature": "nlr"
              },
              {
                "abs": 0.0,
                "baseline": 0.75,
                "candidate": 0.75,
                "feature": "nlr_risk"
              }
            ],
            "provenance": {
              "created_utc": "1970-01-01T00:00:00+00:00",
              "evidence_hash": "76af43af0f0b037ad960221d5f3f3ddf89e659251fb8887f52d4a93febdf0553",
              "tool_version": "1.3.3"
            },
            "recipe": "inflammation_score_v1",
            "schema": "semiocore.audit.score_compare_report.v1",
            "tolerance_abs": 0.0,
            "within_tolerance": true
          }
        },
        {
          "candidate_ref": "expected/biomed_levelc_v1/score/inflammation_score_v1/t72.score.json",
          "label": "t72",
          "raw_ref": "fixtures/biomed_io_v1/levelc/labs_t72.json",
          "score_compare": {
            "baseline": {
              "score": 0.302222222222,
              "score_hash": "8356f20039d8ceb6ff4333a643195502794655dceb55fee14592fea58e3beca1"
            },
            "candidate": {
              "score": 0.302222222222,
              "score_hash": "8356f20039d8ceb6ff4333a643195502794655dceb55fee14592fea58e3beca1"
            },
            "diff": {
              "features_max_abs": 0.0,
              "score_abs": 0.0
            },
            "feature_diffs": [
              {
                "abs": 0.0,
                "baseline": 3.0,
                "candidate": 3.0,
                "feature": "crp_mg_L"
              },
              {
                "abs": 0.0,
                "baseline": 0.3,
                "candidate": 0.3,
                "feature": "crp_risk"
              },
              {
                "abs": 0.0,
                "baseline": 2.222222222222,
                "candidate": 2.222222222222,
                "feature": "nlr"
              },
              {
                "abs": 0.0,
                "baseline": 0.305555555556,
                "candidate": 0.305555555556,
                "feature": "nlr_risk"
              }
            ],
            "provenance": {
              "created_utc": "1970-01-01T00:00:00+00:00",
              "evidence_hash": "7f475cbd7989d254d049ae99398a1ab35f24742c89c5c4c4f7a03fa551db4a07",
              "tool_version": "1.3.3"
            },
            "recipe": "inflammation_score_v1",
            "schema": "semiocore.audit.score_compare_report.v1",
            "tolerance_abs": 0.0,
            "within_tolerance": false
          }
        },
        {
          "candidate_ref": "expected/biomed_levelc_v1/score/inflammation_score_v1/t168.score.json",
          "label": "t168",
          "raw_ref": "fixtures/biomed_io_v1/levelc/labs_t168.json",
          "score_compare": {
            "baseline": {
              "score": 0.15,
              "score_hash": "f124e244b7818aeda7d724f36b09df90d4f974aa9cbf76200e17504c0c13eddd"
            },
            "candidate": {
              "score": 0.15,
              "score_hash": "f124e244b7818aeda7d724f36b09df90d4f974aa9cbf76200e17504c0c13eddd"
            },
            "diff": {
              "features_max_abs": 0.0,
              "score_abs": 0.0
            },
            "feature_diffs": [
              {
                "abs": 0.0,
                "baseline": 1.5,
                "candidate": 1.5,
                "feature": "crp_mg_L"
              },
              {
                "abs": 0.0,
                "baseline": 0.15,
                "candidate": 0.15,
                "feature": "crp_risk"
              },
              {
                "abs": 0.0,
                "baseline": 1.6,
                "candidate": 1.6,
                "feature": "nlr"
              },
              {
                "abs": 0.0,
                "baseline": 0.15,
                "candidate": 0.15,
                "feature": "nlr_risk"
              }
            ],
            "provenance": {
              "created_utc": "1970-01-01T00:00:00+00:00",
              "evidence_hash": "b46c9d4310bc893ade295fdfaebde1e3776c99e2a3f448c1cc9357c42f589303",
              "tool_version": "1.3.3"
            },
            "recipe": "inflammation_score_v1",
            "schema": "semiocore.audit.score_compare_report.v1",
            "tolerance_abs": 0.0,
            "within_tolerance": false